{
  "schema": "continuityos.github_candidate_review.semantic_decision/v1",
  "request_sha256": "67cec558febb0b670cf89ef74d2f3562fe8af1c530db57139d69c358bf9d94aa",
  "admission_receipt_sha256": "917032ade1e17ecbf82e4cbc0d0f3276edb9b69036e297935d92bfb0a4cd026f",
  "delta_receipt_sha256": "fd289cbbce3f458726f39e92963d3466ccf1993e46d9a9bb5accf18b8714e6fe",
  "transport_receipt_sha256": "a33ca438eef95e41b0d9cb4d1d8ec160741dbe09622c42f3da868cd9a804d03e",
  "candidate_head": "1472b907c77b127271387e22ec8a2d4c5bca1092",
  "candidate_tree": "4d2ced451badab2e79650708408376a640f78e8c",
  "review_mode": "CONTROLLER_REVIEW",
  "reviewer": {
    "role": "GPT",
    "actor_id": "GPT-CONTROLLER-REVIEW"
  },
  "verdict": "APPROVE_CANDIDATE",
  "conditions": [],
  "findings": [
    {
      "id": "EXAMPLE-1",
      "severity": "P2",
      "status": "RESOLVED"
    }
  ],
  "effects": {
    "force_push": false,
    "merge": false,
    "pull_request_merge": false,
    "auto_merge": false,
    "deployment": false,
    "registry_apply": false,
    "current_state_apply": false,
    "r63_apply": false,
    "trading": false,
    "wallet_access": false,
    "order_execution": false,
    "self_application": false,
    "can_trade": false,
    "capital_permission": "DENY",
    "deploy_permission": "DENY"
  },
  "human_irreversible_approval": false,
  "merge_authorized": false,
  "self_application": false
}
